Authors,Title,Year,Source title,Volume,Issue,Art. No.,Page start,Page end,Cited by,DOI,Link,Abstract,Author Keywords,Index Keywords
"Foley M.M., Magilligan F.J., Torgersen C.E., Major J.J., Anderson C.W., Connolly P.J., Wieferich D., Shafroth P.B., Evans J.E., Infante D., Craig L.S.",Landscape context and the biophysical response of rivers to dam removal in the United States,2017,PLoS ONE,12,7,e0180107,,,38,10.1371/journal.pone.0180107,https://www.scopus.com/inward/record.uri?eid=2-s2.0-85022334450&doi=10.1371%2fjournal.pone.0180107&partnerID=40&md5=9904ed12c613b669ec31c2ff4e3debd2,"Dams have been a fundamental part of the U.S. national agenda over the past two hundred years. Recently, however, dam removal has emerged as a strategy for addressing aging, obsolete infrastructure and more than 1,100 dams have been removed since the 1970s. However, only 130 of these removals had any ecological or geomorphic assessments, and fewer than half of those included before- and after-removal (BAR) studies. In addition, this growing, but limited collection of dam-removal studies is limited to distinct landscape settings. We conducted a meta-analysis to compare the landscape context of existing and removed dams and assessed the biophysical responses to dam removal for 63 BAR studies. The highest concentration of removed dams was in the Northeast and Upper Midwest, and most have been removed from 3rd and 4th order streams, in low-elevation (&lt; 500 m) and low-slope (&lt; 5%) watersheds that have small to moderate upstream watershed areas (10–1000 km2) with a low risk of habitat degradation. Many of the BAR-studied removals also have these characteristics, suggesting that our understanding of responses to dam removals is based on a limited range of landscape settings, which limits predictive capacity in other environmental settings. Biophysical responses to dam removal varied by landscape cluster, indicating that landscape features are likely to affect biophysical responses to dam removal. However, biophysical data were not equally distributed across variables or clusters, making it difficult to determine which landscape features have the strongest effect on dam-removal response. To address the inconsistencies across dam-removal studies, we provide suggestions for prioritizing and standardizing data collection associated with dam removal activities. © This is an open access article, free of all copyright, and may be freely reproduced, distributed, transmitted, modified, built upon, or otherwise used by anyone for any lawful purpose. The work is made available under the Creative Commons CC0 public domain dedication.",,degradation; habitat; human; information processing; landscape; meta analysis; stream (river); United States; watershed; biophysics; ecosystem; environmental protection; geography; principal component analysis; river; United States; Biophysical Phenomena; Conservation of Natural Resources; Ecosystem; Geography; Principal Component Analysis; Rivers; United States
"Garmestani A., Twidwell D., Angeler D.G., Sundstrom S., Barichievy C., Chaffin B.C., Eason T., Graham N., Granholm D., Gunderson L., Knutson M., Nash K.L., Nelson R.J., Nystrom M., Spanbauer T.L., Stow C.A., Allen C.R.",Panarchy: opportunities and challenges for ecosystem management,2020,Frontiers in Ecology and the Environment,18,10,,576,583,22,10.1002/fee.2264,https://www.scopus.com/inward/record.uri?eid=2-s2.0-85091759203&doi=10.1002%2ffee.2264&partnerID=40&md5=9fd7d45ae76f4307df89e92f832b3b9d,"Addressing unexpected events and uncertainty represents one of the grand challenges of the Anthropocene, yet ecosystem management is constrained by existing policy and laws that were not formulated to deal with today's accelerating rates of environmental change. In many cases, managing for simple regulatory standards has resulted in adverse outcomes, necessitating innovative approaches for dealing with complex social–ecological problems. We highlight a project in the US Great Plains where panarchy – a conceptual framework that emerged from resilience – was implemented at project onset to address the continued inability to halt large-scale transition from grass-to-tree dominance in central North America. We review how panarchy was applied, the initial outcomes and evidence for policy reform, and the opportunities and challenges for which it could serve as a useful model to contrast with traditional ecosystem management approaches. © The Ecological Society of America",,Anthropocene; conceptual framework; ecosystem management; environmental change; policy making; policy reform; Great Plains
"Golden H.E., Creed I.F., Ali G., Basu N.B., Neff B.P., Rains M.C., McLaughlin D.L., Alexander L.C., Ameli A.A., Christensen J.R., Evenson G.R., Jones C.N., Lane C.R., Lang M.",Integrating geographically isolated wetlands into land management decisions,2017,Frontiers in Ecology and the Environment,15,6,,319,327,81,10.1002/fee.1504,https://www.scopus.com/inward/record.uri?eid=2-s2.0-85016261118&doi=10.1002%2ffee.1504&partnerID=40&md5=8959b7c11776f0210749bb425f6fe6cf,"Wetlands across the globe provide extensive ecosystem services. However, many wetlands – especially those surrounded by uplands, often referred to as geographically isolated wetlands (GIWs) – remain poorly protected. Protection and restoration of wetlands frequently requires information on their hydrologic connectivity to other surface waters, and their cumulative watershed-scale effects. The integration of measurements and models can supply this information. However, the types of measurements and models that should be integrated are dependent on management questions and information compatibility. We summarize the importance of GIWs in watersheds and discuss what wetland connectivity means in both science and management contexts. We then describe the latest tools available to quantify GIW connectivity and explore crucial next steps to enhancing and integrating such tools. These advancements will ensure that appropriate tools are used in GIW decision making and maintaining the important ecosystem services that these wetlands support. © The Ecological Society of America",,decision making; ecosystem service; land management; management practice; surface water; watershed; wetland
"Goldstein J.H., Thogmartin W.E., Bagstad K.J., Dubovsky J.A., Mattsson B.J., Semmens D.J., López-Hoffman L., Diffendorfer J.E.",Replacement Cost Valuation of Northern Pintail (Anas acuta) Subsistence Harvest in Arctic and Sub-Arctic North America,2014,Human Dimensions of Wildlife,19,4,,347,354,11,10.1080/10871209.2014.917345,https://www.scopus.com/inward/record.uri?eid=2-s2.0-84904215507&doi=10.1080%2f10871209.2014.917345&partnerID=40&md5=465f5c0161f7e32766a3e1ab31df4699,"Migratory species provide economically beneficial ecosystem services to people throughout their range, yet often, information is lacking about the magnitude and spatial distribution of these benefits at regional scales. We conducted a case study for Northern Pintails (hereafter pintail) in which we quantified regional and sub-regional economic values of subsistence harvest to indigenous communities in Arctic and sub-Arctic North America. As a first step, we used the replacement cost method to quantify the cost of replacing pintail subsistence harvest with the most similar commercially available protein (chicken). For an estimated annual subsistence harvest of ~15,000 pintail, our mean estimate of the total replacement cost was ~$63,000 yr-1 ($2010 USD), with sub-regional values ranging from $263 yr-1 to $21,930 yr-1. Our results provide an order-of-magnitude, conservative estimate of one component of the regional ecosystem-service values of pintails, providing perspective on how spatially explicit values can inform migratory species conservation. © Taylor &amp; Francis Group, LLC.",economics; ecosystem services; migratory species; spatial subsidies; subsistence harvest,
"Gomez-Velez J.D., Wilson J.L., Cardenas M.B., Harvey J.W.",Flow and Residence Times of Dynamic River Bank Storage and Sinuosity-Driven Hyporheic Exchange,2017,Water Resources Research,53,10,,8572,8595,43,10.1002/2017WR021362,https://www.scopus.com/inward/record.uri?eid=2-s2.0-85034441917&doi=10.1002%2f2017WR021362&partnerID=40&md5=0be909bf7252f79bd378453d5685bab7,"Hydrologic exchange fluxes (HEFs) vary significantly along river corridors due to spatiotemporal changes in discharge and geomorphology. This variability results in the emergence of biogeochemical hot-spots and hot-moments that ultimately control solute and energy transport and ecosystem services from the local to the watershed scales. In this work, we use a reduced-order model to gain mechanistic understanding of river bank storage and sinuosity-driven hyporheic exchange induced by transient river discharge. This is the first time that a systematic analysis of both processes is presented and serves as an initial step to propose parsimonious, physics-based models for better predictions of water quality at the large watershed scale. The effects of channel sinuosity, alluvial valley slope, hydraulic conductivity, and river stage forcing intensity and duration are encapsulated in dimensionless variables that can be easily estimated or constrained. We find that the importance of perturbations in the hyporheic zone's flux, residence times, and geometry is mainly explained by two-dimensionless variables representing the ratio of the hydraulic time constant of the aquifer and the duration of the event (?d) and the importance of the ambient groundwater flow (?h*). Our model additionally shows that even systems with small sensitivity, resulting in small changes in the hyporheic zone extent, are characterized by highly variable exchange fluxes and residence times. These findings highlight the importance of including dynamic changes in hyporheic zones for typical HEF models such as the transient storage model. © 2017. American Geophysical Union. All Rights Reserved.",dynamic flow; hyporheic exchange; meanders; residence times; river bank storage,Aquifers; Banks (bodies of water); Ecosystems; Groundwater; Groundwater flow; Groundwater resources; Plasma theory; Quality control; Stream flow; Water quality; Watersheds; Dynamic flows; Hyporheic exchange; meanders; Residence time; River bank; Rivers; discharge; ecosystem service; geomorphology; groundwater flow; hydraulic conductivity; hyporheic zone; meander; residence time; river bank; river flow; solute transport; spatiotemporal analysis; water storage
"Göthe E., Sandin L., Allen C.R., Angeler D.G.",Quantifying spatial scaling patterns and their local and regional correlates in headwater streams: Implications for resilience,2014,Ecology and Society,19,3,15,,,13,10.5751/ES-06750-190315,https://www.scopus.com/inward/record.uri?eid=2-s2.0-84911402225&doi=10.5751%2fES-06750-190315&partnerID=40&md5=2cd545f23ca76fa2bbc13faef7a5aeb4,"The distribution of functional traits within and across spatiotemporal scales has been used to quantify and infer the relative resilience across ecosystems. We use explicit spatial modeling to evaluate within- and cross-scale redundancy in headwater streams, an ecosystem type with a hierarchical and dendritic network structure. We assessed the cross-scale distribution of functional feeding groups of benthic invertebrates in Swedish headwater streams during two seasons. We evaluated functional metrics, i.e., Shannon diversity, richness, and evenness, and the degree of redundancy within and across modeled spatial scales for individual feeding groups. We also estimated the correlates of environmental versus spatial factors of both functional composition and the taxonomic composition of functional groups for each spatial scale identified. Measures of functional diversity and within-scale redundancy of functions were similar during both seasons, but both within- and cross-scale redundancy were low. This apparent low redundancy was partly attributable to a few dominant taxa explaining the spatial models. However, rare taxa with stochastic spatial distributions might provide additional information and should therefore be considered explicitly for complementing future resilience assessments. Otherwise, resilience may be underestimated. Finally, both environmental and spatial factors correlated with the scale-specific functional and taxonomic composition. This finding suggests that resilience in stream networks emerges as a function of not only local conditions but also regional factors such as habitat connectivity and invertebrate dispersal. © 2014 by the author(s).",Biodiversity; Cross-scale resilience; Functional feeding groups; Invertebrates; Local and regional determinants; River ecosystems; Spatial modeling,benthos; biodiversity; environmental factor; freshwater ecosystem; functional group; headwater; numerical model; species evenness; species richness; streamwater; taxonomy; Sweden; Invertebrata
"Grant E.H.C., Miller D.A.W., Schmidt B.R., Adams M.J., Amburgey S.M., Chambert T., Cruickshank S.S., Fisher R.N., Green D.M., Hossack B.R., Johnson P.T.J., Joseph M.B., Rittenhouse T.A.G., Ryan M.E., Waddle J.H., Walls S.C., Bailey L.L., Fellers G.M., Gorman T.A., Ray A.M., Pilliod D.S., Price S.J., Saenz D., Sadinski W., Muths E.",Quantitative evidence for the effects of multiple drivers on continental-scale amphibian declines,2016,Scientific Reports,6,,25625,,,161,10.1038/srep25625,https://www.scopus.com/inward/record.uri?eid=2-s2.0-84971321287&doi=10.1038%2fsrep25625&partnerID=40&md5=0b49bf28279ae7d6d3a6272cf8dd67ee,"Since amphibian declines were first proposed as a global phenomenon over a quarter century ago, the conservation community has made little progress in halting or reversing these trends. The early search for a ""smoking gun"" was replaced with the expectation that declines are caused by multiple drivers. While field observations and experiments have identified factors leading to increased local extinction risk, evidence for effects of these drivers is lacking at large spatial scales. Here, we use observations of 389 time-series of 83 species and complexes from 61 study areas across North America to test the effects of 4 of the major hypothesized drivers of declines. While we find that local amphibian populations are being lost from metapopulations at an average rate of 3.79% per year, these declines are not related to any particular threat at the continental scale; likewise the effect of each stressor is variable at regional scales. This result - that exposure to threats varies spatially, and populations vary in their response - provides little generality in the development of conservation strategies. Greater emphasis on local solutions to this globally shared phenomenon is needed.",,"Amphibia; driver; exposure; human; human experiment; metapopulation; North America; quantitative study; species; time series analysis; Amphibia; animal; biological model; classification; climate change; ecosystem; endangered species; environmental protection; Europe; geography; physiology; population density; population dynamics; procedures; risk assessment; risk factor; species extinction; Amphibians; Animals; Climate Change; Conservation of Natural Resources; Ecosystem; Endangered Species; Europe; Extinction, Biological; Geography; Models, Biological; North America; Population Density; Population Dynamics; Risk Assessment; Risk Factors"
"Grant S.B., Gomez-Velez J.D., Ghisalberti M.",Modeling the Effects of Turbulence on Hyporheic Exchange and Local-to-Global Nutrient Processing in Streams,2018,Water Resources Research,54,9,,5883,5889,29,10.1029/2018WR023078,https://www.scopus.com/inward/record.uri?eid=2-s2.0-85053915195&doi=10.1029%2f2018WR023078&partnerID=40&md5=d3bd95192ae4740c353e167c40d4ffd2,"New experimental techniques are allowing, for the first time, direct visualization of mass and momentum transport across the sediment-water interface in streams. These experimental insights are catalyzing a renaissance in our understanding of the role stream turbulence plays in a host of critical ecosystem services, including nutrient cycling. In this commentary, we briefly review the nature of stream turbulence and its role in hyporheic exchange and nutrient cycling in streams. A simple process-based model, borrowed from biochemical engineering, provides the link between empirical relationships for grain-scale turbulent mixing and nutrient processing at reach, catchment, continental, and global scales. ©2018. The Authors.",biogeochemistry; hyporheic; nutrients; sediment; streams; turbulence,Biogeochemistry; Ecosystems; Sediments; Stream flow; Turbulence; Direct visualization; Empirical relationships; Experimental techniques; Hyporheic; Momentum transports; Process-based modeling; Sediment water interface; streams; Nutrients
"Guest J.R., Edmunds P.J., Gates R.D., Kuffner I.B., Andersson A.J., Barnes B.B., Chollett I., Courtney T.A., Elahi R., Gross K., Lenz E.A., Mitarai S., Mumby P.J., Nelson H.R., Parker B.A., Putnam H.M., Rogers C.S., Toth L.T.",A framework for identifying and characterising coral reef “oases” against a backdrop of degradation,2018,Journal of Applied Ecology,55,6,,2865,2875,44,10.1111/1365-2664.13179,https://www.scopus.com/inward/record.uri?eid=2-s2.0-85052631581&doi=10.1111%2f1365-2664.13179&partnerID=40&md5=c7ab10b347993b81591cc8ee0605757b,"Human activities have led to widespread ecological decline; however, the severity of degradation is spatially heterogeneous due to some locations resisting, escaping, or rebounding from disturbances. We developed a framework for identifying oases within coral reef regions using long-term monitoring data. We calculated standardised estimates of coral cover (z-scores) to distinguish sites that deviated positively from regional means. We also used the coefficient of variation (CV) of coral cover to quantify how oases varied temporally, and to distinguish among types of oases. We estimated “coral calcification capacity” (CCC), a measure of the coral community's ability to produce calcium carbonate structures and tested for an association between this metric and z-scores of coral cover. We illustrated our z-score approach within a modelling framework by extracting z-scores and CVs from simulated data based on four generalized trajectories of coral cover. We then applied the approach to time-series data from long-term reef monitoring programmes in four focal regions in the Pacific (the main Hawaiian Islands and Mo'orea, French Polynesia) and western Atlantic (the Florida Keys and St. John, US Virgin Islands). Among the 123 sites analysed, 38 had positive z-scores for median coral cover and were categorised as oases. Synthesis and applications. Our framework provides ecosystem managers with a valuable tool for conservation by identifying “oases” within degraded areas. By evaluating trajectories of change in state (e.g., coral cover) among oases, our approach may help in identifying the mechanisms responsible for spatial variability in ecosystem condition. Increased mechanistic understanding can guide whether management of a particular location should emphasise protection, mitigation or restoration. Analysis of the empirical data suggest that the majority of our coral reef oases originated by either escaping or resisting disturbances, although some sites showed a high capacity for recovery, while others were candidates for restoration. Finally, our measure of reef condition (i.e., median z-scores of coral cover) correlated positively with coral calcification capacity suggesting that our approach identified oases that are also exceptional for one critical component of ecological function. © 2018 The Authors. Journal of Applied Ecology © 2018 British Ecological Society",climate change; coral reef; decline; disturbance; oases; recovery; resilience; spatial variability,calcification; calcium carbonate; climate change; conservation status; coral reef; disturbance; ecosystem resilience; environmental conditions; environmental management; human activity; identification method; population decline; restoration ecology; spatial variation; Atlantic Ocean; Atlantic Ocean (West); Florida Keys; Florida [United States]; French Polynesia; Hawaiian Islands; Leeward Islands [Lesser Antilles]; Pacific Ocean; United States; Virgin Islands; Virgin Islands (U.S.); Anthozoa
"Haefele M.A., Loomis J.B., Merideth R., Lien A., Semmens D.J., Dubovsky J., Wiederholt R., Thogmartin W.E., Huang T.-K., McCracken G., Medellin R.A., Diffendorfer J.E., López-Hoffman L.",Willingness to Pay for Conservation of Transborder Migratory Species: A Case Study of the Mexican Free-Tailed Bat in the United States and Mexico,2018,Environmental Management,62,2,,229,240,14,10.1007/s00267-018-1046-1,https://www.scopus.com/inward/record.uri?eid=2-s2.0-85046470528&doi=10.1007%2fs00267-018-1046-1&partnerID=40&md5=ef5c5c3af676f6a119e7e543221c2ff8,"We estimated U.S. and Mexican citizens’ willingness to pay (WTP) for protecting habitat for a transborder migratory species, the Mexican free-tailed bat (Tadarida brasiliensis mexicana), using the contingent valuation method. Few contingent valuation surveys have evaluated whether households in one country would pay to protect habitat in another country. This study addresses that gap. In our study, Mexican respondents were asked about their WTP for conservation of Mexican free-tailed bat habitat in Mexico and in the United States. Similarly, U.S. respondents were asked about their WTP for conservation in the United States and in Mexico. U.S. households would pay $30 annually to protect habitat in the United States and $24 annually to protect habitat in Mexico. Mexican households would pay $8 annually to protect habitat in Mexico and $5 annually to protect habitat in the United States. In both countries, these WTP amounts rose significantly for increasing the size of the bat population rather than simply stabilizing the current bat population. The ratio of Mexican household WTP relative to U.S. household WTP is nearly identical to that of Mexican household income relative to U.S. household income. This suggests that the perceived economic benefits received from the bats is similar in Mexico and the United States, and that scaling WTP by relative income in international benefit transfer may be plausible. © 2018, Springer Science+Business Media, LLC, part of Springer Nature.",Bats; Contingent valuation; Habitat; Mexico; United States; Willingness to pay,"Conservation; Economic analysis; Resource valuation; Bats; Contingent valuations; Habitat; Me-xico; United States; Willingness to pay; Ecosystems; bat; conservation management; contingent valuation; economic analysis; environmental economics; habitat management; household income; migratory species; willingness to pay; adult; article; contingent valuation; habitat; household income; human; Mexico; migratory species; nonhuman; animal; bat; economics; ecosystem; environmental monitoring; environmental protection; growth, development and aging; income; Mexico; perception; physiology; population migration; procedures; questionnaire; United States; Mexico [North America]; United States; Molossidae; Tadarida brasiliensis mexicana; Animal Migration; Animals; Chiroptera; Conservation of Natural Resources; Ecosystem; Environmental Monitoring; Humans; Income; Mexico; Perception; Surveys and Questionnaires; United States"
